{
  "_sample_comment": "这是一个 sample，文件实质完成后删掉这行注释",
  "runtime_adapter_id": "chatgpt-runtime-adapter",
  "runtime_type": "chatgpt",
  "configuration_version": "0.1.0",
  "default_model_identifier": null,
  "context_window_tokens": null,
  "tool_capabilities": ["web-search", "github", "file-analysis"],
  "required_environment_variables": []
}
